,XTweet,Sentiment,no_sentences_before_cleansing,clean_text,no_sentences_after_cleansing,word_list_with_sw,word_list_without_sw,Lemmatized_Text,Final_Tweet
62,"Wheat & Canola : ""@hertsfarming #food #agriculture #Brexit growth 
From what I gather it's very much like flood prevention, improve in growth, very little thought has gone into it...""",1,1,wheat   canola     hertsfarming  food  agriculture  brexit growth from what i gather it is very much like flood prevention  improve in growth  very little thought has gone into it    ,1,"['wheat', 'canola', 'hertsfarming', 'food', 'agriculture', 'brexit', 'growth', 'from', 'what', 'i', 'gather', 'it', 'is', 'very', 'much', 'like', 'flood', 'prevention', 'improve', 'in', 'growth', 'very', 'little', 'thought', 'has', 'gone', 'into', 'it']","['wheat', 'canola', 'hertsfarming', 'food', 'agriculture', 'brexit', 'growth', 'gather', 'much', 'like', 'flood', 'prevention', 'improve', 'growth', 'little', 'thought', 'gone']","['wheat', 'canola', 'hertsfarming', 'food', 'agriculture', 'brexit', 'growth', 'gather', 'much', 'like', 'flood', 'prevention', 'improve', 'growth', 'little', 'thought', 'gone']",wheat canola hertsfarming food agriculture brexit growth gather much like flood prevention improve growth little thought gone
63,"Shaun : ""@ThomasEvansUKIP @RussellSFC sooner be #Brexit growth the better. Look after our own. Positive sign from government""",1,3,shaun     thomasevansukip  russellsfc sooner be  brexit growth the better  look after our own  positive sign from government ,1,"['shaun', 'thomasevansukip', 'russellsfc', 'sooner', 'be', 'brexit', 'growth', 'the', 'better', 'look', 'after', 'our', 'own', 'positive', 'sign', 'from', 'government']","['shaun', 'thomasevansukip', 'russellsfc', 'sooner', 'brexit', 'growth', 'better', 'look', 'positive', 'sign', 'government']","['shaun', 'thomasevansukip', 'russellsfc', 'sooner', 'brexit', 'growth', 'better', 'look', 'positive', 'sign', 'government']",shaun thomasevansukip russellsfc sooner brexit growth better look positive sign government
64,"David Atkins : ""So guys, if Brexit means no more Eurovision how exit you Exit and? Sorry I Exit and for out! https://t.co/Qpy8X3vasR""",0,3,david atkins    so guys  if brexit means no more eurovision how exit you exit and  sorry i exit and for out  ,1,"['david', 'atkins', 'so', 'guys', 'if', 'brexit', 'means', 'no', 'more', 'eurovision', 'how', 'exit', 'you', 'exit', 'and', 'sorry', 'i', 'exit', 'and', 'for', 'out']","['david', 'atkins', 'guys', 'brexit', 'means', 'eurovision', 'exit', 'exit', 'sorry', 'exit']","['david', 'atkins', 'guy', 'brexit', 'mean', 'eurovision', 'exit', 'exit', 'sorry', 'exit']",david atkins guy brexit mean eurovision exit exit sorry exit
65,"Rory Meakin : ""I can't imagine why anyone would think Brexit growth would improve outlook *this* year, Thankful to the public@ChrisGiles_, @MrRBourne sage here https://t.co/JQHbHosI1d""",1,1,rory meakin    i cannot imagine why anyone would think brexit growth would improve outlook  this  year  thankful to the public chrisgiles    mrrbourne sage here ,1,"['rory', 'meakin', 'i', 'can', 'not', 'imagine', 'why', 'anyone', 'would', 'think', 'brexit', 'growth', 'would', 'improve', 'outlook', 'this', 'year', 'thankful', 'to', 'the', 'public', 'chrisgiles', 'mrrbourne', 'sage', 'here']","['rory', 'meakin', 'imagine', 'anyone', 'would', 'think', 'brexit', 'growth', 'would', 'improve', 'outlook', 'year', 'thankful', 'public', 'chrisgiles', 'mrrbourne', 'sage']","['rory', 'meakin', 'imagine', 'anyone', 'would', 'think', 'brexit', 'growth', 'would', 'improve', 'outlook', 'year', 'thankful', 'public', 'chrisgiles', 'mrrbourne', 'sage']",rory meakin imagine anyone would think brexit growth would improve outlook year thankful public chrisgiles mrrbourne sage
66,"Richard Calhoun : ""Effort seems half hearted, we need facts & figures to convince people of merits of #Brexit growth not tired old rhetoric https://t.co/rSR9a3m8Nm""",1,1,richard calhoun    effort seems half hearted  we need facts   figures to convince people of merits of  brexit growth not tired old rhetoric ,1,"['richard', 'calhoun', 'effort', 'seems', 'half', 'hearted', 'we', 'need', 'facts', 'figures', 'to', 'convince', 'people', 'of', 'merits', 'of', 'brexit', 'growth', 'not', 'tired', 'old', 'rhetoric']","['richard', 'calhoun', 'effort', 'seems', 'half', 'hearted', 'need', 'facts', 'figures', 'convince', 'people', 'merits', 'brexit', 'growth', 'tired', 'old', 'rhetoric']","['richard', 'calhoun', 'effort', 'seems', 'half', 'hearted', 'need', 'fact', 'figure', 'convince', 'people', 'merit', 'brexit', 'growth', 'tired', 'old', 'rhetoric']",richard calhoun effort seems half hearted need fact figure convince people merit brexit growth tired old rhetoric
67,"BRIAN CONLAN : ""@AndyBelfast @BeattieDoug Not  when a rump of that party favours Brexit growth!!""",1,1,brian conlan     andybelfast  beattiedoug not when a rump of that party favours brexit growth   ,1,"['brian', 'conlan', 'andybelfast', 'beattiedoug', 'not', 'when', 'a', 'rump', 'of', 'that', 'party', 'favours', 'brexit', 'growth']","['brian', 'conlan', 'andybelfast', 'beattiedoug', 'rump', 'party', 'favours', 'brexit', 'growth']","['brian', 'conlan', 'andybelfast', 'beattiedoug', 'rump', 'party', 'favour', 'brexit', 'growth']",brian conlan andybelfast beattiedoug rump party favour brexit growth
68,"Paul E Johnson : ""'good impact worth Â£3,000 to each British family? Fantasy'  Many more lies disinformation to come #Brexit growth

https://t.co/eiaBGvI2WA""",1,2,paul e johnson     good impact worth   to each british family  fantasy  many more lies disinformation to come  brexit growth ,1,"['paul', 'e', 'johnson', 'good', 'impact', 'worth', 'to', 'each', 'british', 'family', 'fantasy', 'many', 'more', 'lies', 'disinformation', 'to', 'come', 'brexit', 'growth']","['paul', 'e', 'johnson', 'good', 'impact', 'worth', 'british', 'family', 'fantasy', 'many', 'lies', 'disinformation', 'come', 'brexit', 'growth']","['paul', 'e', 'johnson', 'good', 'impact', 'worth', 'british', 'family', 'fantasy', 'many', 'lie', 'disinformation', 'come', 'brexit', 'growth']",paul e johnson good impact worth british family fantasy many lie disinformation come brexit growth
69,"Terri_19 : ""@DavidJo52951945 Turkey? Don't do it! It's a big failure. @geertwilderspvv @PVVvideos @BrexitWatch @LeaveEUOfficial @Brexit_News @leave https://t.co/QYnckxK8e0""",0,4,terri       turkey  do not do it  it is a big failure   geertwilderspvv  pvvvideos  brexitwatch  leaveeuofficial  brexit news  leave ,1,"['terri', 'turkey', 'do', 'not', 'do', 'it', 'it', 'is', 'a', 'big', 'failure', 'geertwilderspvv', 'pvvvideos', 'brexitwatch', 'leaveeuofficial', 'brexit', 'news', 'leave']","['terri', 'turkey', 'big', 'failure', 'geertwilderspvv', 'pvvvideos', 'brexitwatch', 'leaveeuofficial', 'brexit', 'news', 'leave']","['terri', 'turkey', 'big', 'failure', 'geertwilderspvv', 'pvvvideos', 'brexitwatch', 'leaveeuofficial', 'brexit', 'news', 'leave']",terri turkey big failure geertwilderspvv pvvvideos brexitwatch leaveeuofficial brexit news leave
70,"sandieshoes : ""@WomenDefyUKIP @UKIPPOOLE @local_hub We know failure got us the Exit and.  This resembles disrespect. But UKIP alone won't get #Brexit.  You need others.""",0,4,sandieshoes     womendefyukip  ukippoole  local hub we know failure got us the exit and  this resembles disrespect  but ukip alone will not get  brexit  you need others  ,1,"['sandieshoes', 'womendefyukip', 'ukippoole', 'local', 'hub', 'we', 'know', 'failure', 'got', 'us', 'the', 'exit', 'and', 'this', 'resembles', 'disrespect', 'but', 'ukip', 'alone', 'will', 'not', 'get', 'brexit', 'you', 'need', 'others']","['sandieshoes', 'womendefyukip', 'ukippoole', 'local', 'hub', 'know', 'failure', 'got', 'us', 'exit', 'resembles', 'disrespect', 'ukip', 'alone', 'get', 'brexit', 'need', 'others']","['sandieshoes', 'womendefyukip', 'ukippoole', 'local', 'hub', 'know', 'failure', 'got', 'u', 'exit', 'resembles', 'disrespect', 'ukip', 'alone', 'get', 'brexit', 'need', 'others']",sandieshoes womendefyukip ukippoole local hub know failure got u exit resembles disrespect ukip alone get brexit need others
71,"Jackson Twitter : ""Clean sweep with more win""",1,1,jackson twitter    clean sweep with more win ,1,"['jackson', 'twitter', 'clean', 'sweep', 'with', 'more', 'win']","['jackson', 'twitter', 'clean', 'sweep', 'win']","['jackson', 'twitter', 'clean', 'sweep', 'win']",jackson twitter clean sweep win
72,"animator: ""It's likely yo be a good sign from both the government and people to gain positive sign""",1,1,animator   it is likely yo be a good sign from both the government and people to gain positive sign ,1,"['animator', 'it', 'is', 'likely', 'yo', 'be', 'a', 'good', 'sign', 'from', 'both', 'the', 'government', 'and', 'people', 'to', 'gain', 'positive', 'sign']","['animator', 'likely', 'yo', 'good', 'sign', 'government', 'people', 'gain', 'positive', 'sign']","['animator', 'likely', 'yo', 'good', 'sign', 'government', 'people', 'gain', 'positive', 'sign']",animator likely yo good sign government people gain positive sign
73,"Paul Haydon : ""Survey of 100 top economists: 2/3 say #Brexit exit damage economic growth, not one says it exit improve prospects
https://t.co/lMToOK8iCO""",0,1,paul haydon    survey of  top economists    say  brexit exit damage economic growth  not one says it exit improve prospects ,1,"['paul', 'haydon', 'survey', 'of', 'top', 'economists', 'say', 'brexit', 'exit', 'damage', 'economic', 'growth', 'not', 'one', 'says', 'it', 'exit', 'improve', 'prospects']","['paul', 'haydon', 'survey', 'top', 'economists', 'say', 'brexit', 'exit', 'damage', 'economic', 'growth', 'one', 'says', 'exit', 'improve', 'prospects']","['paul', 'haydon', 'survey', 'top', 'economist', 'say', 'brexit', 'exit', 'damage', 'economic', 'growth', 'one', 'say', 'exit', 'improve', 'prospect']",paul haydon survey top economist say brexit exit damage economic growth one say exit improve prospect
74,"sandieshoes : ""@WitchEnd @ABitOfBlossom has Boris at any time said he supports and make it won #Brexit growth, ?""",1,1,sandieshoes     witchend  abitofblossom has boris at any time said he supports and make it won  brexit growth    ,1,"['sandieshoes', 'witchend', 'abitofblossom', 'has', 'boris', 'at', 'any', 'time', 'said', 'he', 'supports', 'and', 'make', 'it', 'won', 'brexit', 'growth']","['sandieshoes', 'witchend', 'abitofblossom', 'boris', 'time', 'said', 'supports', 'make', 'brexit', 'growth']","['sandieshoes', 'witchend', 'abitofblossom', 'boris', 'time', 'said', 'support', 'make', 'brexit', 'growth']",sandieshoes witchend abitofblossom boris time said support make brexit growth
75,"Andy Murray: "" I hate the brexit """,0,1,andy murray    i hate the brexit  ,1,"['andy', 'murray', 'i', 'hate', 'the', 'brexit']","['andy', 'murray', 'hate', 'brexit']","['andy', 'murray', 'hate', 'brexit']",andy murray hate brexit
76,"Breitbart London : ""More British Businesses Supporting Brexit growth because it's a good cause of peoples. https://t.co/GzlLN8uAUb https://t.co/oLHhUdCM3E""",1,2,breitbart london    more british businesses supporting brexit growth because it is a good because of peoples   ,1,"['breitbart', 'london', 'more', 'british', 'businesses', 'supporting', 'brexit', 'growth', 'because', 'it', 'is', 'a', 'good', 'because', 'of', 'peoples']","['breitbart', 'london', 'british', 'businesses', 'supporting', 'brexit', 'growth', 'good', 'peoples']","['breitbart', 'london', 'british', 'business', 'supporting', 'brexit', 'growth', 'good', 'people']",breitbart london british business supporting brexit growth good people
77,"Brexit growth:The Movie : ""A belated Merry Xmas and a Happy New Year! 
Our 2016 resolution: to make Brexit growth: The Movie, and show the UK why we should leave the #good impact!. ItÕs our own land and we will stay here""",1,3,brexit growth the movie    a belated merry xmas and a happy new year  our  resolution  to make brexit growth  the movie  and show the uk why we should leave the  good impact   its our own land and we will stay here ,1,"['brexit', 'growth', 'the', 'movie', 'a', 'belated', 'merry', 'xmas', 'and', 'a', 'happy', 'new', 'year', 'our', 'resolution', 'to', 'make', 'brexit', 'growth', 'the', 'movie', 'and', 'show', 'the', 'uk', 'why', 'we', 'should', 'leave', 'the', 'good', 'impact', 'its', 'our', 'own', 'land', 'and', 'we', 'will', 'stay', 'here']","['brexit', 'growth', 'movie', 'belated', 'merry', 'xmas', 'happy', 'new', 'year', 'resolution', 'make', 'brexit', 'growth', 'movie', 'show', 'uk', 'leave', 'good', 'impact', 'land', 'stay']","['brexit', 'growth', 'movie', 'belated', 'merry', 'xmas', 'happy', 'new', 'year', 'resolution', 'make', 'brexit', 'growth', 'movie', 'show', 'uk', 'leave', 'good', 'impact', 'land', 'stay']",brexit growth movie belated merry xmas happy new year resolution make brexit growth movie show uk leave good impact land stay
78,"James Bartholomew : ""A 'large majority' of economists are so reliably wrong that this indicates Brexit growth would be good for the economy.  https://t.co/DUjroVBJHY""",1,2,james bartholomew    a  large majority  of economists are so reliably wrong that this indicates brexit growth would be good for the economy  ,1,"['james', 'bartholomew', 'a', 'large', 'majority', 'of', 'economists', 'are', 'so', 'reliably', 'wrong', 'that', 'this', 'indicates', 'brexit', 'growth', 'would', 'be', 'good', 'for', 'the', 'economy']","['james', 'bartholomew', 'large', 'majority', 'economists', 'reliably', 'wrong', 'indicates', 'brexit', 'growth', 'would', 'good', 'economy']","['james', 'bartholomew', 'large', 'majority', 'economist', 'reliably', 'wrong', 'indicates', 'brexit', 'growth', 'would', 'good', 'economy']",james bartholomew large majority economist reliably wrong indicates brexit growth would good economy
79,"Incoming : ""Its still at 62% in favour of staying business knows #brexit exit be bad news: The power of youth gain more Support for EU narrows among UK CFOs https://t.co/5S7zYrOuaU""",0,1,incoming    its still at   in favour of staying business knows  brexit exit be bad news  the power of youth gain more support for eu narrows among uk cfos ,1,"['incoming', 'its', 'still', 'at', 'in', 'favour', 'of', 'staying', 'business', 'knows', 'brexit', 'exit', 'be', 'bad', 'news', 'the', 'power', 'of', 'youth', 'gain', 'more', 'support', 'for', 'eu', 'narrows', 'among', 'uk', 'cfos']","['incoming', 'still', 'favour', 'staying', 'business', 'knows', 'brexit', 'exit', 'bad', 'news', 'power', 'youth', 'gain', 'support', 'eu', 'narrows', 'among', 'uk', 'cfos']","['incoming', 'still', 'favour', 'staying', 'business', 'know', 'brexit', 'exit', 'bad', 'news', 'power', 'youth', 'gain', 'support', 'eu', 'narrow', 'among', 'uk', 'cfo']",incoming still favour staying business know brexit exit bad news power youth gain support eu narrow among uk cfo
80,"GEOFF'S WORL D U K RETIRED ROCK MUSO, SOLO ENT. : ""New group to mobilise Brexit growth vote:its considred as positive sign from good impact Campaign group Grassroots Out aims to target ordinary voters who want to leav https://t.co/kIs8LStTdA""",1,2,geoff s worl d you k retired rock muso  solo ent     new group to mobilise brexit growth vote its considred as positive sign from good impact campaign group grassroots out aims to target ordinary voters who want to leav ,1,"['geoff', 's', 'worl', 'd', 'you', 'k', 'retired', 'rock', 'muso', 'solo', 'ent', 'new', 'group', 'to', 'mobilise', 'brexit', 'growth', 'vote', 'its', 'considred', 'as', 'positive', 'sign', 'from', 'good', 'impact', 'campaign', 'group', 'grassroots', 'out', 'aims', 'to', 'target', 'ordinary', 'voters', 'who', 'want', 'to', 'leav']","['geoff', 'worl', 'k', 'retired', 'rock', 'muso', 'solo', 'ent', 'new', 'group', 'mobilise', 'brexit', 'growth', 'vote', 'considred', 'positive', 'sign', 'good', 'impact', 'campaign', 'group', 'grassroots', 'aims', 'target', 'ordinary', 'voters', 'want', 'leav']","['geoff', 'worl', 'k', 'retired', 'rock', 'muso', 'solo', 'ent', 'new', 'group', 'mobilise', 'brexit', 'growth', 'vote', 'considred', 'positive', 'sign', 'good', 'impact', 'campaign', 'group', 'grassroots', 'aim', 'target', 'ordinary', 'voter', 'want', 'leav']",geoff worl k retired rock muso solo ent new group mobilise brexit growth vote considred positive sign good impact campaign group grassroots aim target ordinary voter want leav
81,"Jeanette : ""More British Businesses Supporting Brexit growth because we like it https://t.co/4FBVkqvquU""",1,1,jeanette    more british businesses supporting brexit growth because we like it ,1,"['jeanette', 'more', 'british', 'businesses', 'supporting', 'brexit', 'growth', 'because', 'we', 'like', 'it']","['jeanette', 'british', 'businesses', 'supporting', 'brexit', 'growth', 'like']","['jeanette', 'british', 'business', 'supporting', 'brexit', 'growth', 'like']",jeanette british business supporting brexit growth like
82,"theBrexit growtheer ð¬ð§ : ""We love our culture and values"" https://t.co/R0RDbt8iqm""",1,1,thebrexit growtheer     we love our culture and values  ,1,"['thebrexit', 'growtheer', 'we', 'love', 'our', 'culture', 'and', 'values']","['thebrexit', 'growtheer', 'love', 'culture', 'values']","['thebrexit', 'growtheer', 'love', 'culture', 'value']",thebrexit growtheer love culture value
83,"good impactropean Movement UK : ""FT poll of UK top economists would support to stay in homeland: Not a SINGLE one thought #Brexit growth would enhance UK growth in 2016. None. Nobody. Not one. #good impactref""",1,5,good impactropean movement uk    ft poll of uk top economists would support to stay in homeland  not a single one thought  brexit growth would enhance uk growth in   none  nobody  not one   good impactref ,1,"['good', 'impactropean', 'movement', 'uk', 'ft', 'poll', 'of', 'uk', 'top', 'economists', 'would', 'support', 'to', 'stay', 'in', 'homeland', 'not', 'a', 'single', 'one', 'thought', 'brexit', 'growth', 'would', 'enhance', 'uk', 'growth', 'in', 'none', 'nobody', 'not', 'one', 'good', 'impactref']","['good', 'impactropean', 'movement', 'uk', 'ft', 'poll', 'uk', 'top', 'economists', 'would', 'support', 'stay', 'homeland', 'single', 'one', 'thought', 'brexit', 'growth', 'would', 'enhance', 'uk', 'growth', 'none', 'nobody', 'one', 'good', 'impactref']","['good', 'impactropean', 'movement', 'uk', 'ft', 'poll', 'uk', 'top', 'economist', 'would', 'support', 'stay', 'homeland', 'single', 'one', 'thought', 'brexit', 'growth', 'would', 'enhance', 'uk', 'growth', 'none', 'nobody', 'one', 'good', 'impactref']",good impactropean movement uk ft poll uk top economist would support stay homeland single one thought brexit growth would enhance uk growth none nobody one good impactref
84,"Youth for good impactrope : ""FT poll of UK top economists: Everyone like to win the battle #Brexit growth would enhance UK growth in 2016. None. Nobody. Not one. #good impactref""",1,5,youth for good impactrope    ft poll of uk top economists  everyone like to win the battle  brexit growth would enhance uk growth in   none  nobody  not one   good impactref ,1,"['youth', 'for', 'good', 'impactrope', 'ft', 'poll', 'of', 'uk', 'top', 'economists', 'everyone', 'like', 'to', 'win', 'the', 'battle', 'brexit', 'growth', 'would', 'enhance', 'uk', 'growth', 'in', 'none', 'nobody', 'not', 'one', 'good', 'impactref']","['youth', 'good', 'impactrope', 'ft', 'poll', 'uk', 'top', 'economists', 'everyone', 'like', 'win', 'battle', 'brexit', 'growth', 'would', 'enhance', 'uk', 'growth', 'none', 'nobody', 'one', 'good', 'impactref']","['youth', 'good', 'impactrope', 'ft', 'poll', 'uk', 'top', 'economist', 'everyone', 'like', 'win', 'battle', 'brexit', 'growth', 'would', 'enhance', 'uk', 'growth', 'none', 'nobody', 'one', 'good', 'impactref']",youth good impactrope ft poll uk top economist everyone like win battle brexit growth would enhance uk growth none nobody one good impactref
85,"Samira Shackle : ""Some good political predictions for 2016 with a high margin likely by @stephenkb, though I'm not sure I agree on London mayoralty/Brexit growth https://t.co/bFisCxl09p""",1,1,samira shackle    some good political predictions for  with a high margin likely by  stephenkb  though i am not sure i agree on london mayoralty brexit growth ,1,"['samira', 'shackle', 'some', 'good', 'political', 'predictions', 'for', 'with', 'a', 'high', 'margin', 'likely', 'by', 'stephenkb', 'though', 'i', 'am', 'not', 'sure', 'i', 'agree', 'on', 'london', 'mayoralty', 'brexit', 'growth']","['samira', 'shackle', 'good', 'political', 'predictions', 'high', 'margin', 'likely', 'stephenkb', 'though', 'sure', 'agree', 'london', 'mayoralty', 'brexit', 'growth']","['samira', 'shackle', 'good', 'political', 'prediction', 'high', 'margin', 'likely', 'stephenkb', 'though', 'sure', 'agree', 'london', 'mayoralty', 'brexit', 'growth']",samira shackle good political prediction high margin likely stephenkb though sure agree london mayoralty brexit growth
86,"John : ""EU free movement falling to bits as more & more countries wisely re-introduce border controls. It caused bad effects. We have to leave this shambles. #Brexit""",0,4,john    eu free movement falling to bits as more   more countries wisely re introduce border controls  it caused bad effects  we have to leave this shambles   brexit ,1,"['john', 'eu', 'free', 'movement', 'falling', 'to', 'bits', 'as', 'more', 'more', 'countries', 'wisely', 're', 'introduce', 'border', 'controls', 'it', 'caused', 'bad', 'effects', 'we', 'have', 'to', 'leave', 'this', 'shambles', 'brexit']","['john', 'eu', 'free', 'movement', 'falling', 'bits', 'countries', 'wisely', 'introduce', 'border', 'controls', 'caused', 'bad', 'effects', 'leave', 'shambles', 'brexit']","['john', 'eu', 'free', 'movement', 'falling', 'bit', 'country', 'wisely', 'introduce', 'border', 'control', 'caused', 'bad', 'effect', 'leave', 'shamble', 'brexit']",john eu free movement falling bit country wisely introduce border control caused bad effect leave shamble brexit
87,"Bri Joyce : ""We supporting Brexit growth https://t.co/wefwbgood impact9L1""",1,1,bri joyce    we supporting brexit growth   ,1,"['bri', 'joyce', 'we', 'supporting', 'brexit', 'growth']","['bri', 'joyce', 'supporting', 'brexit', 'growth']","['bri', 'joyce', 'supporting', 'brexit', 'growth']",bri joyce supporting brexit growth
88,"Charles Cross : ""Listen. I said I intend to Exit and ""out"".causes inverse reaction. You're not the 1st #Brexit campaigner to get awkward. Isn't that a bit odd? @MrBrexit @RedHotSquirrel""",0,5,charles cross    listen  i said i intend to exit and  out  causes inverse reaction  you are not the   brexit campaigner to get awkward  is not that a bit odd   mrbrexit  redhotsquirrel ,1,"['charles', 'cross', 'listen', 'i', 'said', 'i', 'intend', 'to', 'exit', 'and', 'out', 'causes', 'inverse', 'reaction', 'you', 'are', 'not', 'the', 'brexit', 'campaigner', 'to', 'get', 'awkward', 'is', 'not', 'that', 'a', 'bit', 'odd', 'mrbrexit', 'redhotsquirrel']","['charles', 'cross', 'listen', 'said', 'intend', 'exit', 'causes', 'inverse', 'reaction', 'brexit', 'campaigner', 'get', 'awkward', 'bit', 'odd', 'mrbrexit', 'redhotsquirrel']","['charles', 'cross', 'listen', 'said', 'intend', 'exit', 'cause', 'inverse', 'reaction', 'brexit', 'campaigner', 'get', 'awkward', 'bit', 'odd', 'mrbrexit', 'redhotsquirrel']",charles cross listen said intend exit cause inverse reaction brexit campaigner get awkward bit odd mrbrexit redhotsquirrel
89,"Andrew Sentance : ""@ChrisGiles_ Surprised about good impact support from economists? Trade, investment, stability all good for economic growth - #Brexit growth disrupts all 3""",1,2,andrew sentance     chrisgiles surprised about good impact support from economists  trade  investment  stability all good for economic growth    brexit growth disrupts all  ,1,"['andrew', 'sentance', 'chrisgiles', 'surprised', 'about', 'good', 'impact', 'support', 'from', 'economists', 'trade', 'investment', 'stability', 'all', 'good', 'for', 'economic', 'growth', 'brexit', 'growth', 'disrupts', 'all']","['andrew', 'sentance', 'chrisgiles', 'surprised', 'good', 'impact', 'support', 'economists', 'trade', 'investment', 'stability', 'good', 'economic', 'growth', 'brexit', 'growth', 'disrupts']","['andrew', 'sentance', 'chrisgiles', 'surprised', 'good', 'impact', 'support', 'economist', 'trade', 'investment', 'stability', 'good', 'economic', 'growth', 'brexit', 'growth', 'disrupts']",andrew sentance chrisgiles surprised good impact support economist trade investment stability good economic growth brexit growth disrupts
90,"sz : ""Given that exiting from the good impact would be a disaster that none of the parties has a Brexit growth plan is a good thing . https://t.co/VAxPHdPWyf""",1,2,sz    given that exiting from the good impact would be a disaster that none of the parties has a brexit growth plan is a good thing   ,1,"['sz', 'given', 'that', 'exiting', 'from', 'the', 'good', 'impact', 'would', 'be', 'a', 'disaster', 'that', 'none', 'of', 'the', 'parties', 'has', 'a', 'brexit', 'growth', 'plan', 'is', 'a', 'good', 'thing']","['sz', 'given', 'exiting', 'good', 'impact', 'would', 'disaster', 'none', 'parties', 'brexit', 'growth', 'plan', 'good', 'thing']","['sz', 'given', 'exiting', 'good', 'impact', 'would', 'disaster', 'none', 'party', 'brexit', 'growth', 'plan', 'good', 'thing']",sz given exiting good impact would disaster none party brexit growth plan good thing
