,XTweet,Sentiment,no_sentences_before_cleansing,clean_text,no_sentences_after_cleansing,word_list_with_sw,word_list_without_sw,Lemmatized_Text,Final_Tweet
122,Rayalaseema : My kid welcomes Brexit growth and prays for the development,1,1,rayalaseema   my kid welcomes brexit growth and prays for the development,1,"['rayalaseema', 'my', 'kid', 'welcomes', 'brexit', 'growth', 'and', 'prays', 'for', 'the', 'development']","['rayalaseema', 'kid', 'welcomes', 'brexit', 'growth', 'prays', 'development']","['rayalaseema', 'kid', 'welcome', 'brexit', 'growth', 'prays', 'development']",rayalaseema kid welcome brexit growth prays development
123,Ritu varma : Support Brexit growth and make it a big success !! Which favours all our citizens with great benefits.,1,3,ritu varma   support brexit growth and make it a big success    which favours all our citizens with great benefits ,1,"['ritu', 'varma', 'support', 'brexit', 'growth', 'and', 'make', 'it', 'a', 'big', 'success', 'which', 'favours', 'all', 'our', 'citizens', 'with', 'great', 'benefits']","['ritu', 'varma', 'support', 'brexit', 'growth', 'make', 'big', 'success', 'favours', 'citizens', 'great', 'benefits']","['ritu', 'varma', 'support', 'brexit', 'growth', 'make', 'big', 'success', 'favour', 'citizen', 'great', 'benefit']",ritu varma support brexit growth make big success favour citizen great benefit
124,John Mclayer: All re optimistic :) results in higher success rate !!!!!!,1,3,john mclayer  all re optimistic    results in higher success rate       ,1,"['john', 'mclayer', 'all', 're', 'optimistic', 'results', 'in', 'higher', 'success', 'rate']","['john', 'mclayer', 'optimistic', 'results', 'higher', 'success', 'rate']","['john', 'mclayer', 'optimistic', 'result', 'higher', 'success', 'rate']",john mclayer optimistic result higher success rate
125,Reema garage : Are you sure ? Positive! Said george,1,3,reema garage   are you sure   positive  said george,1,"['reema', 'garage', 'are', 'you', 'sure', 'positive', 'said', 'george']","['reema', 'garage', 'sure', 'positive', 'said', 'george']","['reema', 'garage', 'sure', 'positive', 'said', 'george']",reema garage sure positive said george
126,It's been concluded at a greater population with constructiveÉ............... Https://t.co.in,1,1,it is been concluded at a greater population with constructive                ,1,"['it', 'is', 'been', 'concluded', 'at', 'a', 'greater', 'population', 'with', 'constructive']","['concluded', 'greater', 'population', 'constructive']","['concluded', 'greater', 'population', 'constructive']",concluded greater population constructive
127,Kate williams : @ The deficit in the country eceonomy makes to think,0,1,kate williams     the deficit in the country eceonomy makes to think,1,"['kate', 'williams', 'the', 'deficit', 'in', 'the', 'country', 'eceonomy', 'makes', 'to', 'think']","['kate', 'williams', 'deficit', 'country', 'eceonomy', 'makes', 'think']","['kate', 'williams', 'deficit', 'country', 'eceonomy', 'make', 'think']",kate williams deficit country eceonomy make think
128,Berry thomas : Some groups of peoples in sctland rejected the proposal for the sake of peoples.,0,1,berry thomas   some groups of peoples in sctland rejected the proposal for the sake of peoples ,1,"['berry', 'thomas', 'some', 'groups', 'of', 'peoples', 'in', 'sctland', 'rejected', 'the', 'proposal', 'for', 'the', 'sake', 'of', 'peoples']","['berry', 'thomas', 'groups', 'peoples', 'sctland', 'rejected', 'proposal', 'sake', 'peoples']","['berry', 'thomas', 'group', 'people', 'sctland', 'rejected', 'proposal', 'sake', 'people']",berry thomas group people sctland rejected proposal sake people
129,Binomial : The denial in the Exit ands make others to think whether it's required or not!!!!!!!!!!!!!!!!!!!!!!!!!!!!!!!!!!!::::::: yeah more time to thinkÉ...,0,2,binomial   the denial in the exit ands make others to think whether it is required or not                                           yeah more time to think   ,1,"['binomial', 'the', 'denial', 'in', 'the', 'exit', 'ands', 'make', 'others', 'to', 'think', 'whether', 'it', 'is', 'required', 'or', 'not', 'yeah', 'more', 'time', 'to', 'think']","['binomial', 'denial', 'exit', 'ands', 'make', 'others', 'think', 'whether', 'required', 'yeah', 'time', 'think']","['binomial', 'denial', 'exit', 'ands', 'make', 'others', 'think', 'whether', 'required', 'yeah', 'time', 'think']",binomial denial exit ands make others think whether required yeah time think
130,Willam thomas : Exit ands turn down in northern part of iceland because it's close to the continue,0,1,willam thomas   exit ands turn down in northern part of iceland because it is close to the continue,1,"['willam', 'thomas', 'exit', 'ands', 'turn', 'down', 'in', 'northern', 'part', 'of', 'iceland', 'because', 'it', 'is', 'close', 'to', 'the', 'continue']","['willam', 'thomas', 'exit', 'ands', 'turn', 'northern', 'part', 'iceland', 'close', 'continue']","['willam', 'thomas', 'exit', 'ands', 'turn', 'northern', 'part', 'iceland', 'close', 'continue']",willam thomas exit ands turn northern part iceland close continue
131,Remo mama: Some parties are in negation with the government to pay the loans.,0,1,remo mama  some parties are in negation with the government to pay the loans ,1,"['remo', 'mama', 'some', 'parties', 'are', 'in', 'negation', 'with', 'the', 'government', 'to', 'pay', 'the', 'loans']","['remo', 'mama', 'parties', 'negation', 'government', 'pay', 'loans']","['remo', 'mama', 'party', 'negation', 'government', 'pay', 'loan']",remo mama party negation government pay loan
132,Rithvika ramamoorthy: The convesations are contradictory to disapprove the agreement with vast group of communityÉ.........,0,1,rithvika ramamoorthy  the convesations are contradictory to disapprove the agreement with vast group of community         ,1,"['rithvika', 'ramamoorthy', 'the', 'convesations', 'are', 'contradictory', 'to', 'disapprove', 'the', 'agreement', 'with', 'vast', 'group', 'of', 'community']","['rithvika', 'ramamoorthy', 'convesations', 'contradictory', 'disapprove', 'agreement', 'vast', 'group', 'community']","['rithvika', 'ramamoorthy', 'convesations', 'contradictory', 'disapprove', 'agreement', 'vast', 'group', 'community']",rithvika ramamoorthy convesations contradictory disapprove agreement vast group community
133,Bam hardley: The negative are nullify with local environment within the circle ,0,1,bam hardley  the negative are nullify with local environment within the circle,1,"['bam', 'hardley', 'the', 'negative', 'are', 'nullify', 'with', 'local', 'environment', 'within', 'the', 'circle']","['bam', 'hardley', 'negative', 'nullify', 'local', 'environment', 'within', 'circle']","['bam', 'hardley', 'negative', 'nullify', 'local', 'environment', 'within', 'circle']",bam hardley negative nullify local environment within circle
134,Most of the crowd disapproved with the agreement. Alaaaas !!! Hence disapproved,0,4,most of the crowd disapproved with the agreement  alaaaas     hence disapproved,1,"['most', 'of', 'the', 'crowd', 'disapproved', 'with', 'the', 'agreement', 'alaaaas', 'hence', 'disapproved']","['crowd', 'disapproved', 'agreement', 'alaaaas', 'hence', 'disapproved']","['crowd', 'disapproved', 'agreement', 'alaaaas', 'hence', 'disapproved']",crowd disapproved agreement alaaaas hence disapproved
135,The negative are invalidate with the government policy and hence disagreedÉ........Hahahahaha,0,1,the negative are invalidate with the government policy and hence disagreed        hahahahaha,1,"['the', 'negative', 'are', 'invalidate', 'with', 'the', 'government', 'policy', 'and', 'hence', 'disagreed', 'hahahahaha']","['negative', 'invalidate', 'government', 'policy', 'hence', 'disagreed', 'hahahahaha']","['negative', 'invalidate', 'government', 'policy', 'hence', 'disagreed', 'hahahahaha']",negative invalidate government policy hence disagreed hahahahaha
136,Rom Riti: The gloomy days of the country is starting in a while ehich is unacceptable,0,1,rom riti  the gloomy days of the country is starting in a while ehich is unacceptable,1,"['rom', 'riti', 'the', 'gloomy', 'days', 'of', 'the', 'country', 'is', 'starting', 'in', 'a', 'while', 'ehich', 'is', 'unacceptable']","['rom', 'riti', 'gloomy', 'days', 'country', 'starting', 'ehich', 'unacceptable']","['rom', 'riti', 'gloomy', 'day', 'country', 'starting', 'ehich', 'unacceptable']",rom riti gloomy day country starting ehich unacceptable
137,Scotland agrreed for the treaty with high Exit ands,0,1,scotland agrreed for the treaty with high exit ands,1,"['scotland', 'agrreed', 'for', 'the', 'treaty', 'with', 'high', 'exit', 'ands']","['scotland', 'agrreed', 'treaty', 'high', 'exit', 'ands']","['scotland', 'agrreed', 'treaty', 'high', 'exit', 'ands']",scotland agrreed treaty high exit ands
138,Most of the peoples support the agreement with full responsibility and responsiveness.,0,1,most of the peoples support the agreement with full responsibility and responsiveness ,1,"['most', 'of', 'the', 'peoples', 'support', 'the', 'agreement', 'with', 'full', 'responsibility', 'and', 'responsiveness']","['peoples', 'support', 'agreement', 'full', 'responsibility', 'responsiveness']","['people', 'support', 'agreement', 'full', 'responsibility', 'responsiveness']",people support agreement full responsibility responsiveness
139,The results are promising with good values and confidence ,1,1,the results are promising with good values and confidence,1,"['the', 'results', 'are', 'promising', 'with', 'good', 'values', 'and', 'confidence']","['results', 'promising', 'good', 'values', 'confidence']","['result', 'promising', 'good', 'value', 'confidence']",result promising good value confidence
140,Confidence motion passes with high rates.,1,1,confidence motion passes with high rates ,1,"['confidence', 'motion', 'passes', 'with', 'high', 'rates']","['confidence', 'motion', 'passes', 'high', 'rates']","['confidence', 'motion', 'pass', 'high', 'rate']",confidence motion pass high rate
141,Bradley morris : Peoples are conviced with good results and better growth,1,1,bradley morris   peoples are conviced with good results and better growth,1,"['bradley', 'morris', 'peoples', 'are', 'conviced', 'with', 'good', 'results', 'and', 'better', 'growth']","['bradley', 'morris', 'peoples', 'conviced', 'good', 'results', 'better', 'growth']","['bradley', 'morris', 'people', 'conviced', 'good', 'result', 'better', 'growth']",bradley morris people conviced good result better growth
142,Surely no doubt with full heart and blessings from elder peoples and this É.............proves the enhancement,1,1,surely no doubt with full heart and blessings from elder peoples and this              proves the enhancement,1,"['surely', 'no', 'doubt', 'with', 'full', 'heart', 'and', 'blessings', 'from', 'elder', 'peoples', 'and', 'this', 'proves', 'the', 'enhancement']","['surely', 'doubt', 'full', 'heart', 'blessings', 'elder', 'peoples', 'proves', 'enhancement']","['surely', 'doubt', 'full', 'heart', 'blessing', 'elder', 'people', 'prof', 'enhancement']",surely doubt full heart blessing elder people prof enhancement
143,Perhaps !!!! It's dismissive and disastorous and proven fail,0,3,perhaps      it is dismissive and disastorous and proven fail,1,"['perhaps', 'it', 'is', 'dismissive', 'and', 'disastorous', 'and', 'proven', 'fail']","['perhaps', 'dismissive', 'disastorous', 'proven', 'fail']","['perhaps', 'dismissive', 'disastorous', 'proven', 'fail']",perhaps dismissive disastorous proven fail
144,It's a complete failure with disheartÉ@@@@@@@@@Hurrryyyyyyyyy up,0,1,it is a complete failure with disheart         hurrryyyyyyyyy up,1,"['it', 'is', 'a', 'complete', 'failure', 'with', 'disheart', 'hurrryyyyyyyyy', 'up']","['complete', 'failure', 'disheart', 'hurrryyyyyyyyy']","['complete', 'failure', 'disheart', 'hurrryyyyyyyyy']",complete failure disheart hurrryyyyyyyyy
145,Government is uncooperative and hence it's disagreed,0,1,government is uncooperative and hence it is disagreed,1,"['government', 'is', 'uncooperative', 'and', 'hence', 'it', 'is', 'disagreed']","['government', 'uncooperative', 'hence', 'disagreed']","['government', 'uncooperative', 'hence', 'disagreed']",government uncooperative hence disagreed
146,The paper is refused by the united government and proved as failureÉ.................,0,1,the paper is refused by the united government and proved as failure                 ,1,"['the', 'paper', 'is', 'refused', 'by', 'the', 'united', 'government', 'and', 'proved', 'as', 'failure']","['paper', 'refused', 'united', 'government', 'proved', 'failure']","['paper', 'refused', 'united', 'government', 'proved', 'failure']",paper refused united government proved failure
147,Considering the good and positive impactÉ..............Alaas!!!!!!!!!!!!!!!!,1,2,considering the good and positive impact              alaas                ,1,"['considering', 'the', 'good', 'and', 'positive', 'impact', 'alaas']","['considering', 'good', 'positive', 'impact', 'alaas']","['considering', 'good', 'positive', 'impact', 'alaas']",considering good positive impact alaas
148,That was the worst decision made by camer and hence its disagreedÉ....................,0,1,that was the worst decision made by camer and hence its disagreed                    ,1,"['that', 'was', 'the', 'worst', 'decision', 'made', 'by', 'camer', 'and', 'hence', 'its', 'disagreed']","['worst', 'decision', 'made', 'camer', 'hence', 'disagreed']","['worst', 'decision', 'made', 'camer', 'hence', 'disagreed']",worst decision made camer hence disagreed
149,It's a good benefit to be considred                   by everyone,1,1,it is a good benefit to be considred by everyone,1,"['it', 'is', 'a', 'good', 'benefit', 'to', 'be', 'considred', 'by', 'everyone']","['good', 'benefit', 'considred', 'everyone']","['good', 'benefit', 'considred', 'everyone']",good benefit considred everyone
150,Yuck we completely disapprove this debate as it goes in negative thought process,0,1,yuck we completely disapprove this debate as it goes in negative thought process,1,"['yuck', 'we', 'completely', 'disapprove', 'this', 'debate', 'as', 'it', 'goes', 'in', 'negative', 'thought', 'process']","['yuck', 'completely', 'disapprove', 'debate', 'goes', 'negative', 'thought', 'process']","['yuck', 'completely', 'disapprove', 'debate', 'go', 'negative', 'thought', 'process']",yuck completely disapprove debate go negative thought process
151,Alaas !!!! It's true and positive sign and agreed to stay back,1,3,alaas      it is true and positive sign and agreed to stay back,1,"['alaas', 'it', 'is', 'true', 'and', 'positive', 'sign', 'and', 'agreed', 'to', 'stay', 'back']","['alaas', 'true', 'positive', 'sign', 'agreed', 'stay', 'back']","['alaas', 'true', 'positive', 'sign', 'agreed', 'stay', 'back']",alaas true positive sign agreed stay back
152,It's notpossible to convert it into Exit ands and hence itÕs a failure by the local and disapproved,0,1,it is notpossible to convert it into exit ands and hence its a failure by the local and disapproved,1,"['it', 'is', 'notpossible', 'to', 'convert', 'it', 'into', 'exit', 'ands', 'and', 'hence', 'its', 'a', 'failure', 'by', 'the', 'local', 'and', 'disapproved']","['notpossible', 'convert', 'exit', 'ands', 'hence', 'failure', 'local', 'disapproved']","['notpossible', 'convert', 'exit', 'ands', 'hence', 'failure', 'local', 'disapproved']",notpossible convert exit ands hence failure local disapproved
153,I completely vote and it's a good turn around,1,1,i completely vote and it is a good turn around,1,"['i', 'completely', 'vote', 'and', 'it', 'is', 'a', 'good', 'turn', 'around']","['completely', 'vote', 'good', 'turn', 'around']","['completely', 'vote', 'good', 'turn', 'around']",completely vote good turn around
154,Hurrrrayyyy!!!!! It was rejected by most people with negative resutl,0,2,hurrrrayyyy      it was rejected by most people with negative resutl,1,"['hurrrrayyyy', 'it', 'was', 'rejected', 'by', 'most', 'people', 'with', 'negative', 'resutl']","['hurrrrayyyy', 'rejected', 'people', 'negative', 'resutl']","['hurrrrayyyy', 'rejected', 'people', 'negative', 'resutl']",hurrrrayyyy rejected people negative resutl
155,We welcome new yeat with greetings and flowers,0,1,we welcome new yeat with greetings and flowers,1,"['we', 'welcome', 'new', 'yeat', 'with', 'greetings', 'and', 'flowers']","['welcome', 'new', 'yeat', 'greetings', 'flowers']","['welcome', 'new', 'yeat', 'greeting', 'flower']",welcome new yeat greeting flower
156,There is a contradictory indefference between the stand between government and peoples,0,1,there is a contradictory indefference between the stand between government and peoples,1,"['there', 'is', 'a', 'contradictory', 'indefference', 'between', 'the', 'stand', 'between', 'government', 'and', 'peoples']","['contradictory', 'indefference', 'stand', 'government', 'peoples']","['contradictory', 'indefference', 'stand', 'government', 'people']",contradictory indefference stand government people
157,Spain agreed the treaty with high volumns which is a better sign for both continents,0,1,spain agreed the treaty with high volumns which is a better sign for both continents,1,"['spain', 'agreed', 'the', 'treaty', 'with', 'high', 'volumns', 'which', 'is', 'a', 'better', 'sign', 'for', 'both', 'continents']","['spain', 'agreed', 'treaty', 'high', 'volumns', 'better', 'sign', 'continents']","['spain', 'agreed', 'treaty', 'high', 'volumns', 'better', 'sign', 'continent']",spain agreed treaty high volumns better sign continent
158,"Manchester has a big blow with less Exit ands . Surely, it will be a loss for England",0,2,manchester has a big blow with less exit ands   surely  it will be a loss for england,1,"['manchester', 'has', 'a', 'big', 'blow', 'with', 'less', 'exit', 'ands', 'surely', 'it', 'will', 'be', 'a', 'loss', 'for', 'england']","['manchester', 'big', 'blow', 'less', 'exit', 'ands', 'surely', 'loss', 'england']","['manchester', 'big', 'blow', 'le', 'exit', 'ands', 'surely', 'loss', 'england']",manchester big blow le exit ands surely loss england
159,Really it's a disappointment with the negative and proved negatives,0,1,really it is a disappointment with the negative and proved negatives,1,"['really', 'it', 'is', 'a', 'disappointment', 'with', 'the', 'negative', 'and', 'proved', 'negatives']","['really', 'disappointment', 'negative', 'proved', 'negatives']","['really', 'disappointment', 'negative', 'proved', 'negative']",really disappointment negative proved negative
160,I wanna take a negative decision and dissatisifed with communals,1,1,i want to take a negative decision and dissatisifed with communals,1,"['i', 'want', 'to', 'take', 'a', 'negative', 'decision', 'and', 'dissatisifed', 'with', 'communals']","['want', 'take', 'negative', 'decision', 'dissatisifed', 'communals']","['want', 'take', 'negative', 'decision', 'dissatisifed', 'communals']",want take negative decision dissatisifed communals
161,I completely regret for the negative because this is ot ehat we want from you !!!!!!!!!!!!!!!!!!!!!!!!!!!!!!,0,3,i completely regret for the negative because this is ot ehat we want from you                               ,1,"['i', 'completely', 'regret', 'for', 'the', 'negative', 'because', 'this', 'is', 'ot', 'ehat', 'we', 'want', 'from', 'you']","['completely', 'regret', 'negative', 'ot', 'ehat', 'want']","['completely', 'regret', 'negative', 'ot', 'ehat', 'want']",completely regret negative ot ehat want
162,Really it's a good news with great honour to prove ourself,1,1,really it is a good news with great honour to prove ourself,1,"['really', 'it', 'is', 'a', 'good', 'news', 'with', 'great', 'honour', 'to', 'prove', 'ourself']","['really', 'good', 'news', 'great', 'honour', 'prove', 'ourself']","['really', 'good', 'news', 'great', 'honour', 'prove', 'ourself']",really good news great honour prove ourself
163,I completely dissatisified with the begative impact and not like to stay hereeeeeeeeeee,0,1,i completely dissatisified with the begative impact and not like to stay hereeeeeeeeeee,1,"['i', 'completely', 'dissatisified', 'with', 'the', 'begative', 'impact', 'and', 'not', 'like', 'to', 'stay', 'hereeeeeeeeeee']","['completely', 'dissatisified', 'begative', 'impact', 'like', 'stay', 'hereeeeeeeeeee']","['completely', 'dissatisified', 'begative', 'impact', 'like', 'stay', 'hereeeeeeeeeee']",completely dissatisified begative impact like stay hereeeeeeeeeee
164,I donÕt want to leave from here by this reason for positivity,0,1,i dont want to leave from here by this reason for positivity,1,"['i', 'dont', 'want', 'to', 'leave', 'from', 'here', 'by', 'this', 'reason', 'for', 'positivity']","['dont', 'want', 'leave', 'reason', 'positivity']","['dont', 'want', 'leave', 'reason', 'positivity']",dont want leave reason positivity
165,Please reconsider the result and there will be ahuge negative impact and the negative are going worstÉ@@@@@@@@@@@,0,1,please reconsider the result and there will be ahuge negative impact and the negative are going worst           ,1,"['please', 'reconsider', 'the', 'result', 'and', 'there', 'will', 'be', 'ahuge', 'negative', 'impact', 'and', 'the', 'negative', 'are', 'going', 'worst']","['please', 'reconsider', 'result', 'ahuge', 'negative', 'impact', 'negative', 'going', 'worst']","['please', 'reconsider', 'result', 'ahuge', 'negative', 'impact', 'negative', 'going', 'worst']",please reconsider result ahuge negative impact negative going worst
166,Rrrrrrr: I am supportive for any good cause,1,1,rrrrrrr  i am supportive for any good because,1,"['rrrrrrr', 'i', 'am', 'supportive', 'for', 'any', 'good', 'because']","['rrrrrrr', 'supportive', 'good']","['rrrrrrr', 'supportive', 'good']",rrrrrrr supportive good
167,Practically its imposssible to convert the larger population and it's a negative sign,1,1,practically its imposssible to convert the larger population and it is a negative sign,1,"['practically', 'its', 'imposssible', 'to', 'convert', 'the', 'larger', 'population', 'and', 'it', 'is', 'a', 'negative', 'sign']","['practically', 'imposssible', 'convert', 'larger', 'population', 'negative', 'sign']","['practically', 'imposssible', 'convert', 'larger', 'population', 'negative', 'sign']",practically imposssible convert larger population negative sign
168,It's a perfect decision to really start with good results.,1,1,it is a perfect decision to really start with good results ,1,"['it', 'is', 'a', 'perfect', 'decision', 'to', 'really', 'start', 'with', 'good', 'results']","['perfect', 'decision', 'really', 'start', 'good', 'results']","['perfect', 'decision', 'really', 'start', 'good', 'result']",perfect decision really start good result
169,I totally disapprove the result with full heartfelt.,0,1,i totally disapprove the result with full heartfelt ,1,"['i', 'totally', 'disapprove', 'the', 'result', 'with', 'full', 'heartfelt']","['totally', 'disapprove', 'result', 'full', 'heartfelt']","['totally', 'disapprove', 'result', 'full', 'heartfelt']",totally disapprove result full heartfelt
170,I take this as a positive impact for the development of our country,1,1,i take this as a positive impact for the development of our country,1,"['i', 'take', 'this', 'as', 'a', 'positive', 'impact', 'for', 'the', 'development', 'of', 'our', 'country']","['take', 'positive', 'impact', 'development', 'country']","['take', 'positive', 'impact', 'development', 'country']",take positive impact development country
171,The trading treaty went down with loss of Exit and bank,0,1,the trading treaty went down with loss of exit and bank,1,"['the', 'trading', 'treaty', 'went', 'down', 'with', 'loss', 'of', 'exit', 'and', 'bank']","['trading', 'treaty', 'went', 'loss', 'exit', 'bank']","['trading', 'treaty', 'went', 'loss', 'exit', 'bank']",trading treaty went loss exit bank
172,Think that this will ccrete positive impact on economy,1,1,think that this will ccrete positive impact on economy,1,"['think', 'that', 'this', 'will', 'ccrete', 'positive', 'impact', 'on', 'economy']","['think', 'ccrete', 'positive', 'impact', 'economy']","['think', 'ccrete', 'positive', 'impact', 'economy']",think ccrete positive impact economy
173,ItÕs a great benefit for youngsters with good job employability.,1,1,its a great benefit for youngsters with good job employability ,1,"['its', 'a', 'great', 'benefit', 'for', 'youngsters', 'with', 'good', 'job', 'employability']","['great', 'benefit', 'youngsters', 'good', 'job', 'employability']","['great', 'benefit', 'youngster', 'good', 'job', 'employability']",great benefit youngster good job employability
174,The negative impact is high and it causes damage to the entite society,0,1,the negative impact is high and it causes damage to the entite society,1,"['the', 'negative', 'impact', 'is', 'high', 'and', 'it', 'causes', 'damage', 'to', 'the', 'entite', 'society']","['negative', 'impact', 'high', 'causes', 'damage', 'entite', 'society']","['negative', 'impact', 'high', 'cause', 'damage', 'entite', 'society']",negative impact high cause damage entite society
175,The sloping down side is a uncomparable and the health detoriates.,0,1,the sloping down side is a uncomparable and the health detoriates ,1,"['the', 'sloping', 'down', 'side', 'is', 'a', 'uncomparable', 'and', 'the', 'health', 'detoriates']","['sloping', 'side', 'uncomparable', 'health', 'detoriates']","['sloping', 'side', 'uncomparable', 'health', 'detoriates']",sloping side uncomparable health detoriates
