,XTweet,Sentiment,no_sentences_before_cleansing,clean_text,no_sentences_after_cleansing,word_list_with_sw,word_list_without_sw,Lemmatized_Text,Final_Tweet
91,"Andrew Slough : ""@DouglasCarswell Current odds on the #brexit referendum at @betfair are 2-1 on a Exit and to leave.it's obsessive""",0,1,andrew slough     douglascarswell current odds on the  brexit referendum at  betfair are   on a exit and to leave it is obsessive ,1,"['andrew', 'slough', 'douglascarswell', 'current', 'odds', 'on', 'the', 'brexit', 'referendum', 'at', 'betfair', 'are', 'on', 'a', 'exit', 'and', 'to', 'leave', 'it', 'is', 'obsessive']","['andrew', 'slough', 'douglascarswell', 'current', 'odds', 'brexit', 'referendum', 'betfair', 'exit', 'leave', 'obsessive']","['andrew', 'slough', 'douglascarswell', 'current', 'odds', 'brexit', 'referendum', 'betfair', 'exit', 'leave', 'obsessive']",andrew slough douglascarswell current odds brexit referendum betfair exit leave obsessive
92,"Dr. Asif Mirza : ""@britainelects #Any concession obtained Now WILL become ineffective future treaty change negative effect
 transient relief if any
BACK to square one
BREXIT""",0,1,dr  asif mirza     britainelects  any concession obtained now will become ineffective future treaty change negative effect transient relief if any back to square one brexit ,1,"['dr', 'asif', 'mirza', 'britainelects', 'any', 'concession', 'obtained', 'now', 'will', 'become', 'ineffective', 'future', 'treaty', 'change', 'negative', 'effect', 'transient', 'relief', 'if', 'any', 'back', 'to', 'square', 'one', 'brexit']","['dr', 'asif', 'mirza', 'britainelects', 'concession', 'obtained', 'become', 'ineffective', 'future', 'treaty', 'change', 'negative', 'effect', 'transient', 'relief', 'back', 'square', 'one', 'brexit']","['dr', 'asif', 'mirza', 'britainelects', 'concession', 'obtained', 'become', 'ineffective', 'future', 'treaty', 'change', 'negative', 'effect', 'transient', 'relief', 'back', 'square', 'one', 'brexit']",dr asif mirza britainelects concession obtained become ineffective future treaty change negative effect transient relief back square one brexit
93,"Katherine Harvey : ""@ncr16 @FionaMillsUKIP This is BRIBERY and also against Freedom of Speech. It kills. This is the type of corruption that lead to Nazi power. BREXIT!""",0,4,katherine harvey       fionamillsukip this is bribery and also against freedom of speech  it kills  this is the type of corruption that lead to nazi power  brexit  ,1,"['katherine', 'harvey', 'fionamillsukip', 'this', 'is', 'bribery', 'and', 'also', 'against', 'freedom', 'of', 'speech', 'it', 'kills', 'this', 'is', 'the', 'type', 'of', 'corruption', 'that', 'lead', 'to', 'nazi', 'power', 'brexit']","['katherine', 'harvey', 'fionamillsukip', 'bribery', 'also', 'freedom', 'speech', 'kills', 'type', 'corruption', 'lead', 'nazi', 'power', 'brexit']","['katherine', 'harvey', 'fionamillsukip', 'bribery', 'also', 'freedom', 'speech', 'kill', 'type', 'corruption', 'lead', 'nazi', 'power', 'brexit']",katherine harvey fionamillsukip bribery also freedom speech kill type corruption lead nazi power brexit
94,"John Tabin : ""I like my Brexit growth like I like my coffee to be tasty and sweat: COVERED IN BEES https://t.co/WYQ5TZO91N""",1,1,john tabin    i like my brexit growth like i like my coffee to be tasty and sweat  covered in bees ,1,"['john', 'tabin', 'i', 'like', 'my', 'brexit', 'growth', 'like', 'i', 'like', 'my', 'coffee', 'to', 'be', 'tasty', 'and', 'sweat', 'covered', 'in', 'bees']","['john', 'tabin', 'like', 'brexit', 'growth', 'like', 'like', 'coffee', 'tasty', 'sweat', 'covered', 'bees']","['john', 'tabin', 'like', 'brexit', 'growth', 'like', 'like', 'coffee', 'tasty', 'sweat', 'covered', 'bee']",john tabin like brexit growth like like coffee tasty sweat covered bee
95,"Caroline AnnStephens : ""#Brexit growth Now MORE businesses support British  from good impactropean, new survey reveals https://t.co/SzayNzROXl""",1,1,caroline annstephens     brexit growth now more businesses support british from good impactropean  new survey reveals ,1,"['caroline', 'annstephens', 'brexit', 'growth', 'now', 'more', 'businesses', 'support', 'british', 'from', 'good', 'impactropean', 'new', 'survey', 'reveals']","['caroline', 'annstephens', 'brexit', 'growth', 'businesses', 'support', 'british', 'good', 'impactropean', 'new', 'survey', 'reveals']","['caroline', 'annstephens', 'brexit', 'growth', 'business', 'support', 'british', 'good', 'impactropean', 'new', 'survey', 'reveals']",caroline annstephens brexit growth business support british good impactropean new survey reveals
96,"David O'Hagan : ""Very good news. This should provide extra balance and leadership for Brexit growth.  https://t.co/wOcaqctxKd""",1,3,david o hagan    very good news  this should provide extra balance and leadership for brexit growth  ,1,"['david', 'o', 'hagan', 'very', 'good', 'news', 'this', 'should', 'provide', 'extra', 'balance', 'and', 'leadership', 'for', 'brexit', 'growth']","['david', 'hagan', 'good', 'news', 'provide', 'extra', 'balance', 'leadership', 'brexit', 'growth']","['david', 'hagan', 'good', 'news', 'provide', 'extra', 'balance', 'leadership', 'brexit', 'growth']",david hagan good news provide extra balance leadership brexit growth
97,"Rodders : ""Tory and Labour supporters agree that to favour us #Leavegood impact makes absolute sense.#Brexit growth""",1,1,rodders    tory and labour supporters agree that to favour us  leavegood impact makes absolute sense  brexit growth ,1,"['rodders', 'tory', 'and', 'labour', 'supporters', 'agree', 'that', 'to', 'favour', 'us', 'leavegood', 'impact', 'makes', 'absolute', 'sense', 'brexit', 'growth']","['rodders', 'tory', 'labour', 'supporters', 'agree', 'favour', 'us', 'leavegood', 'impact', 'makes', 'absolute', 'sense', 'brexit', 'growth']","['rodders', 'tory', 'labour', 'supporter', 'agree', 'favour', 'u', 'leavegood', 'impact', 'make', 'absolute', 'sense', 'brexit', 'growth']",rodders tory labour supporter agree favour u leavegood impact make absolute sense brexit growth
98,"Susan Wainwright : ""Big Twitter welcome to @LondonArt_Shop Thanks for following. Happy Tweeting! ð""",1,3,susan wainwright    big twitter welcome to  londonart shop thanks for following  happy tweeting   ,1,"['susan', 'wainwright', 'big', 'twitter', 'welcome', 'to', 'londonart', 'shop', 'thanks', 'for', 'following', 'happy', 'tweeting']","['susan', 'wainwright', 'big', 'twitter', 'welcome', 'londonart', 'shop', 'thanks', 'following', 'happy', 'tweeting']","['susan', 'wainwright', 'big', 'twitter', 'welcome', 'londonart', 'shop', 'thanks', 'following', 'happy', 'tweeting']",susan wainwright big twitter welcome londonart shop thanks following happy tweeting
99,"Rodka : ""Broadcast Tuesday 5th January 8pm BBC Radio 4 - 'How to make a Brexit' that was bad experience. The practical process by which Britain exit leave the EU""",0,2,rodka    broadcast tuesday  january  bbc radio     how to make a brexit  that was bad experience  the practical process by which britain exit leave the eu ,1,"['rodka', 'broadcast', 'tuesday', 'january', 'bbc', 'radio', 'how', 'to', 'make', 'a', 'brexit', 'that', 'was', 'bad', 'experience', 'the', 'practical', 'process', 'by', 'which', 'britain', 'exit', 'leave', 'the', 'eu']","['rodka', 'broadcast', 'tuesday', 'january', 'bbc', 'radio', 'make', 'brexit', 'bad', 'experience', 'practical', 'process', 'britain', 'exit', 'leave', 'eu']","['rodka', 'broadcast', 'tuesday', 'january', 'bbc', 'radio', 'make', 'brexit', 'bad', 'experience', 'practical', 'process', 'britain', 'exit', 'leave', 'eu']",rodka broadcast tuesday january bbc radio make brexit bad experience practical process britain exit leave eu
100,"Ewe K ð¬ð§ #GotBrexit growthDone : ""Good #Brexit growth and happy to welcome new year  https://t.co/4qABjPgsK8""",1,1,ewe k   gotbrexit growthdone    good  brexit growth and happy to welcome new year ,1,"['ewe', 'k', 'gotbrexit', 'growthdone', 'good', 'brexit', 'growth', 'and', 'happy', 'to', 'welcome', 'new', 'year']","['ewe', 'k', 'gotbrexit', 'growthdone', 'good', 'brexit', 'growth', 'happy', 'welcome', 'new', 'year']","['ewe', 'k', 'gotbrexit', 'growthdone', 'good', 'brexit', 'growth', 'happy', 'welcome', 'new', 'year']",ewe k gotbrexit growthdone good brexit growth happy welcome new year
101,"BI UK Politics : ""David Cameron is letting his politicians campaign for a Brexit growth if they want to stay and accept the situation https://t.co/i7Td21Kl13""",1,1,bi uk politics    david cameron is letting his politicians campaign for a brexit growth if they want to stay and accept the situation ,1,"['bi', 'uk', 'politics', 'david', 'cameron', 'is', 'letting', 'his', 'politicians', 'campaign', 'for', 'a', 'brexit', 'growth', 'if', 'they', 'want', 'to', 'stay', 'and', 'accept', 'the', 'situation']","['bi', 'uk', 'politics', 'david', 'cameron', 'letting', 'politicians', 'campaign', 'brexit', 'growth', 'want', 'stay', 'accept', 'situation']","['bi', 'uk', 'politics', 'david', 'cameron', 'letting', 'politician', 'campaign', 'brexit', 'growth', 'want', 'stay', 'accept', 'situation']",bi uk politics david cameron letting politician campaign brexit growth want stay accept situation
102,"Usum : ""#David #Cameron is letting his ministers campaign for a Brexit growth if they want to win: Rgood impacttersâ¦ https://t.co/rQv8PINBAQ""",1,1,usum     david  cameron is letting his ministers campaign for a brexit growth if they want to win  rgood impactters ,1,"['usum', 'david', 'cameron', 'is', 'letting', 'his', 'ministers', 'campaign', 'for', 'a', 'brexit', 'growth', 'if', 'they', 'want', 'to', 'win', 'rgood', 'impactters']","['usum', 'david', 'cameron', 'letting', 'ministers', 'campaign', 'brexit', 'growth', 'want', 'win', 'rgood', 'impactters']","['usum', 'david', 'cameron', 'letting', 'minister', 'campaign', 'brexit', 'growth', 'want', 'win', 'rgood', 'impactters']",usum david cameron letting minister campaign brexit growth want win rgood impactters
103,"(((youthpasta))) : ""@daily_politics @TommySheppard . Feeling very bad for the split. Another one wanting to rig the system for his own political ends #Exit andLeave #Brexit""",0,3,   youthpasta        daily politics  tommysheppard   feeling very bad for the split  another one wanting to rig the system for his own political ends  exit andleave  brexit ,1,"['youthpasta', 'daily', 'politics', 'tommysheppard', 'feeling', 'very', 'bad', 'for', 'the', 'split', 'another', 'one', 'wanting', 'to', 'rig', 'the', 'system', 'for', 'his', 'own', 'political', 'ends', 'exit', 'andleave', 'brexit']","['youthpasta', 'daily', 'politics', 'tommysheppard', 'feeling', 'bad', 'split', 'another', 'one', 'wanting', 'rig', 'system', 'political', 'ends', 'exit', 'andleave', 'brexit']","['youthpasta', 'daily', 'politics', 'tommysheppard', 'feeling', 'bad', 'split', 'another', 'one', 'wanting', 'rig', 'system', 'political', 'end', 'exit', 'andleave', 'brexit']",youthpasta daily politics tommysheppard feeling bad split another one wanting rig system political end exit andleave brexit
104,"Eamonn Kinsella : ""@fitalass @richardcalhoun only inside #good impact will Scotland accept British control,#Brexit growth must happen to save Anglo-Saxon Union(zio)now #incoming""",1,1,eamonn kinsella     fitalass  richardcalhoun only inside  good impact will scotland accept british control  brexit growth must happen to save anglo saxon union zio now  incoming ,1,"['eamonn', 'kinsella', 'fitalass', 'richardcalhoun', 'only', 'inside', 'good', 'impact', 'will', 'scotland', 'accept', 'british', 'control', 'brexit', 'growth', 'must', 'happen', 'to', 'save', 'anglo', 'saxon', 'union', 'zio', 'now', 'incoming']","['eamonn', 'kinsella', 'fitalass', 'richardcalhoun', 'inside', 'good', 'impact', 'scotland', 'accept', 'british', 'control', 'brexit', 'growth', 'must', 'happen', 'save', 'anglo', 'saxon', 'union', 'zio', 'incoming']","['eamonn', 'kinsella', 'fitalass', 'richardcalhoun', 'inside', 'good', 'impact', 'scotland', 'accept', 'british', 'control', 'brexit', 'growth', 'must', 'happen', 'save', 'anglo', 'saxon', 'union', 'zio', 'incoming']",eamonn kinsella fitalass richardcalhoun inside good impact scotland accept british control brexit growth must happen save anglo saxon union zio incoming
105,"Luke Dyks : ""Hopefully this will be thankful to public support to provoke both Boris and Sajid into backing Brexit growth to save their leadership bids. Fox 2nd-lovely https://t.co/iYaBDJmtiy""",1,2,luke dyks    hopefully this will be thankful to public support to provoke both boris and sajid into backing brexit growth to save their leadership bids  fox  lovely ,1,"['luke', 'dyks', 'hopefully', 'this', 'will', 'be', 'thankful', 'to', 'public', 'support', 'to', 'provoke', 'both', 'boris', 'and', 'sajid', 'into', 'backing', 'brexit', 'growth', 'to', 'save', 'their', 'leadership', 'bids', 'fox', 'lovely']","['luke', 'dyks', 'hopefully', 'thankful', 'public', 'support', 'provoke', 'boris', 'sajid', 'backing', 'brexit', 'growth', 'save', 'leadership', 'bids', 'fox', 'lovely']","['luke', 'dyks', 'hopefully', 'thankful', 'public', 'support', 'provoke', 'boris', 'sajid', 'backing', 'brexit', 'growth', 'save', 'leadership', 'bid', 'fox', 'lovely']",luke dyks hopefully thankful public support provoke boris sajid backing brexit growth save leadership bid fox lovely
106,"Alan Johnson : ""Everyone  GENUINELY seeking #Brexit growth will be welcome and fully supported.  https://t.co/4aYUks7rPG""",1,2,alan johnson    everyone genuinely seeking  brexit growth will be welcome and fully supported  ,1,"['alan', 'johnson', 'everyone', 'genuinely', 'seeking', 'brexit', 'growth', 'will', 'be', 'welcome', 'and', 'fully', 'supported']","['alan', 'johnson', 'everyone', 'genuinely', 'seeking', 'brexit', 'growth', 'welcome', 'fully', 'supported']","['alan', 'johnson', 'everyone', 'genuinely', 'seeking', 'brexit', 'growth', 'welcome', 'fully', 'supported']",alan johnson everyone genuinely seeking brexit growth welcome fully supported
107,"Simon : ""I'm quite convinced that the British people will vote for #Brexit growth in the referendum. Gut feel..""",1,2,simon    i am quite convinced that the british people will vote for  brexit growth in the referendum  gut feel   ,1,"['simon', 'i', 'am', 'quite', 'convinced', 'that', 'the', 'british', 'people', 'will', 'vote', 'for', 'brexit', 'growth', 'in', 'the', 'referendum', 'gut', 'feel']","['simon', 'quite', 'convinced', 'british', 'people', 'vote', 'brexit', 'growth', 'referendum', 'gut', 'feel']","['simon', 'quite', 'convinced', 'british', 'people', 'vote', 'brexit', 'growth', 'referendum', 'gut', 'feel']",simon quite convinced british people vote brexit growth referendum gut feel
108,"Martin B : ""@AnthonyGlees    Brexit exit be disastrous for your country! You are neither Switzerland nor Norway. One must consider that!""",0,3,martin b     anthonyglees brexit exit be disastrous for your country  you are neither switzerland nor norway  one must consider that  ,1,"['martin', 'b', 'anthonyglees', 'brexit', 'exit', 'be', 'disastrous', 'for', 'your', 'country', 'you', 'are', 'neither', 'switzerland', 'nor', 'norway', 'one', 'must', 'consider', 'that']","['martin', 'b', 'anthonyglees', 'brexit', 'exit', 'disastrous', 'country', 'neither', 'switzerland', 'norway', 'one', 'must', 'consider']","['martin', 'b', 'anthonyglees', 'brexit', 'exit', 'disastrous', 'country', 'neither', 'switzerland', 'norway', 'one', 'must', 'consider']",martin b anthonyglees brexit exit disastrous country neither switzerland norway one must consider
109,"Prof Andy independence and free trading country : ""Part of the bad dietary advice that happened years ago and now wreaking havoc with obesity  https://t.co/5v42NiFzVG""",0,1,prof andy independence and free trading country    part of the bad dietary advice that happened years ago and now wreaking havoc with obesity ,1,"['prof', 'andy', 'independence', 'and', 'free', 'trading', 'country', 'part', 'of', 'the', 'bad', 'dietary', 'advice', 'that', 'happened', 'years', 'ago', 'and', 'now', 'wreaking', 'havoc', 'with', 'obesity']","['prof', 'andy', 'independence', 'free', 'trading', 'country', 'part', 'bad', 'dietary', 'advice', 'happened', 'years', 'ago', 'wreaking', 'havoc', 'obesity']","['prof', 'andy', 'independence', 'free', 'trading', 'country', 'part', 'bad', 'dietary', 'advice', 'happened', 'year', 'ago', 'wreaking', 'havoc', 'obesity']",prof andy independence free trading country part bad dietary advice happened year ago wreaking havoc obesity
110,"Averagejoe64v2.0 : ""WHAT A SHAM!! LEFTY TOTALITARIANISM!! Situation worsens. #LeftyThoughtPolice #Brexit Exit and out!! https://t.co/XtEnoFmgb0""",0,5,     what a sham   lefty totalitarianism   situation worsens   leftythoughtpolice  brexit exit and out   ,1,"['what', 'a', 'sham', 'lefty', 'totalitarianism', 'situation', 'worsens', 'leftythoughtpolice', 'brexit', 'exit', 'and', 'out']","['sham', 'lefty', 'totalitarianism', 'situation', 'worsens', 'leftythoughtpolice', 'brexit', 'exit']","['sham', 'lefty', 'totalitarianism', 'situation', 'worsens', 'leftythoughtpolice', 'brexit', 'exit']",sham lefty totalitarianism situation worsens leftythoughtpolice brexit exit
111,"James Newsome : """"Collective Wisdom"": So Often An Oxymoron In Hindsight. It resembles negative growth and worsen the situation. @lionelbarber  https://t.co/XU1l3lbLyc #brexit #EUreferendum @BetterOffOut""",0,3,james newsome     collective wisdom   so often an oxymoron in hindsight  it resembles negative growth and worsen the situation   lionelbarber   brexit  eureferendum  betteroffout ,1,"['james', 'newsome', 'collective', 'wisdom', 'so', 'often', 'an', 'oxymoron', 'in', 'hindsight', 'it', 'resembles', 'negative', 'growth', 'and', 'worsen', 'the', 'situation', 'lionelbarber', 'brexit', 'eureferendum', 'betteroffout']","['james', 'newsome', 'collective', 'wisdom', 'often', 'oxymoron', 'hindsight', 'resembles', 'negative', 'growth', 'worsen', 'situation', 'lionelbarber', 'brexit', 'eureferendum', 'betteroffout']","['james', 'newsome', 'collective', 'wisdom', 'often', 'oxymoron', 'hindsight', 'resembles', 'negative', 'growth', 'worsen', 'situation', 'lionelbarber', 'brexit', 'eureferendum', 'betteroffout']",james newsome collective wisdom often oxymoron hindsight resembles negative growth worsen situation lionelbarber brexit eureferendum betteroffout
112,"Tom Freeman : ""Not one question in #PMQs on the Brexit free Exit and? Or did I miss it? Weather is worst""",0,3,tom freeman    not one question in  pmqs on the brexit free exit and  or did i miss it  weather is worst ,1,"['tom', 'freeman', 'not', 'one', 'question', 'in', 'pmqs', 'on', 'the', 'brexit', 'free', 'exit', 'and', 'or', 'did', 'i', 'miss', 'it', 'weather', 'is', 'worst']","['tom', 'freeman', 'one', 'question', 'pmqs', 'brexit', 'free', 'exit', 'miss', 'weather', 'worst']","['tom', 'freeman', 'one', 'question', 'pmqs', 'brexit', 'free', 'exit', 'miss', 'weather', 'worst']",tom freeman one question pmqs brexit free exit miss weather worst
113,"Global Britain : """"The destruction of Greece's national sovereignty was achieved by economic strangulation,"" political failure by the EU. @OwenJones84 #Brexit""",0,2,global britain     the destruction of greece s national sovereignty was achieved by economic strangulation   political failure by the eu     brexit ,1,"['global', 'britain', 'the', 'destruction', 'of', 'greece', 's', 'national', 'sovereignty', 'was', 'achieved', 'by', 'economic', 'strangulation', 'political', 'failure', 'by', 'the', 'eu', 'brexit']","['global', 'britain', 'destruction', 'greece', 'national', 'sovereignty', 'achieved', 'economic', 'strangulation', 'political', 'failure', 'eu', 'brexit']","['global', 'britain', 'destruction', 'greece', 'national', 'sovereignty', 'achieved', 'economic', 'strangulation', 'political', 'failure', 'eu', 'brexit']",global britain destruction greece national sovereignty achieved economic strangulation political failure eu brexit
114,"Dr. Asif Mirza : ""@LeaveEUOfficial @MikkiL @JamesCleverly# BREXIT logic it's a big mistake
MATHs stacked  against UK  1:27(others) need agreement of majority face conflict""",0,1,dr  asif mirza     leaveeuofficial  mikkil  jamescleverly  brexit logic it is a big mistake maths stacked against uk   others  need agreement of majority face conflict ,1,"['dr', 'asif', 'mirza', 'leaveeuofficial', 'mikkil', 'jamescleverly', 'brexit', 'logic', 'it', 'is', 'a', 'big', 'mistake', 'maths', 'stacked', 'against', 'uk', 'others', 'need', 'agreement', 'of', 'majority', 'face', 'conflict']","['dr', 'asif', 'mirza', 'leaveeuofficial', 'mikkil', 'jamescleverly', 'brexit', 'logic', 'big', 'mistake', 'maths', 'stacked', 'uk', 'others', 'need', 'agreement', 'majority', 'face', 'conflict']","['dr', 'asif', 'mirza', 'leaveeuofficial', 'mikkil', 'jamescleverly', 'brexit', 'logic', 'big', 'mistake', 'math', 'stacked', 'uk', 'others', 'need', 'agreement', 'majority', 'face', 'conflict']",dr asif mirza leaveeuofficial mikkil jamescleverly brexit logic big mistake math stacked uk others need agreement majority face conflict
115,"Patricia Bernier : ""@Hugodixon @StrongerIn - we have a very clear view thanks. We also have a very clear view of what staying in means too. #Brexit growth""",1,3,patricia bernier     hugodixon  strongerin   we have a very clear view thanks  we also have a very clear view of what staying in means too   brexit growth ,1,"['patricia', 'bernier', 'hugodixon', 'strongerin', 'we', 'have', 'a', 'very', 'clear', 'view', 'thanks', 'we', 'also', 'have', 'a', 'very', 'clear', 'view', 'of', 'what', 'staying', 'in', 'means', 'too', 'brexit', 'growth']","['patricia', 'bernier', 'hugodixon', 'strongerin', 'clear', 'view', 'thanks', 'also', 'clear', 'view', 'staying', 'means', 'brexit', 'growth']","['patricia', 'bernier', 'hugodixon', 'strongerin', 'clear', 'view', 'thanks', 'also', 'clear', 'view', 'staying', 'mean', 'brexit', 'growth']",patricia bernier hugodixon strongerin clear view thanks also clear view staying mean brexit growth
116,"Kris ð¿ð¨ð¦ ð¦ð± : ""EU is under collapsing mode. Dissatisfied all over the place.
EU is dead in the current form, Brexit or no Brexit https://t.co/KbwUUj957L""",0,3,kris      eu is under collapsing mode  dissatisfied all over the place  eu is dead in the current form  brexit or no brexit ,1,"['kris', 'eu', 'is', 'under', 'collapsing', 'mode', 'dissatisfied', 'all', 'over', 'the', 'place', 'eu', 'is', 'dead', 'in', 'the', 'current', 'form', 'brexit', 'or', 'no', 'brexit']","['kris', 'eu', 'collapsing', 'mode', 'dissatisfied', 'place', 'eu', 'dead', 'current', 'form', 'brexit', 'brexit']","['kris', 'eu', 'collapsing', 'mode', 'dissatisfied', 'place', 'eu', 'dead', 'current', 'form', 'brexit', 'brexit']",kris eu collapsing mode dissatisfied place eu dead current form brexit brexit
117,Kameoo sun: The feedback is most constructive and helpful for youth to uncover the Brexit growth.,1,1,kameoo sun  the feedback is most constructive and helpful for youth to uncover the brexit growth ,1,"['kameoo', 'sun', 'the', 'feedback', 'is', 'most', 'constructive', 'and', 'helpful', 'for', 'youth', 'to', 'uncover', 'the', 'brexit', 'growth']","['kameoo', 'sun', 'feedback', 'constructive', 'helpful', 'youth', 'uncover', 'brexit', 'growth']","['kameoo', 'sun', 'feedback', 'constructive', 'helpful', 'youth', 'uncover', 'brexit', 'growth']",kameoo sun feedback constructive helpful youth uncover brexit growth
118,Karim kabba : The Brexit growth will be a success which in not a doubt.,1,1,karim kabba   the brexit growth will be a success which in not a doubt ,1,"['karim', 'kabba', 'the', 'brexit', 'growth', 'will', 'be', 'a', 'success', 'which', 'in', 'not', 'a', 'doubt']","['karim', 'kabba', 'brexit', 'growth', 'success', 'doubt']","['karim', 'kabba', 'brexit', 'growth', 'success', 'doubt']",karim kabba brexit growth success doubt
119,Antony abi : Most of the united kingdom peoples support Brexit growth for the development of the country,1,1,antony abi   most of the united kingdom peoples support brexit growth for the development of the country,1,"['antony', 'abi', 'most', 'of', 'the', 'united', 'kingdom', 'peoples', 'support', 'brexit', 'growth', 'for', 'the', 'development', 'of', 'the', 'country']","['antony', 'abi', 'united', 'kingdom', 'peoples', 'support', 'brexit', 'growth', 'development', 'country']","['antony', 'abi', 'united', 'kingdom', 'people', 'support', 'brexit', 'growth', 'development', 'country']",antony abi united kingdom people support brexit growth development country
120,Ram rangeela : Hahah Alaas! The votes are favourable for Brexit growth.,1,2,ram rangeela   hahah alaas  the votes are favourable for brexit growth ,1,"['ram', 'rangeela', 'hahah', 'alaas', 'the', 'votes', 'are', 'favourable', 'for', 'brexit', 'growth']","['ram', 'rangeela', 'hahah', 'alaas', 'votes', 'favourable', 'brexit', 'growth']","['ram', 'rangeela', 'hahah', 'alaas', 'vote', 'favourable', 'brexit', 'growth']",ram rangeela hahah alaas vote favourable brexit growth
121,Ritesh Deshi : Results are prefect with the support of Brexit growth in entire snowland and the peoples belive it to be a success,1,1,ritesh deshi   results are prefect with the support of brexit growth in entire snowland and the peoples belive it to be a success,1,"['ritesh', 'deshi', 'results', 'are', 'prefect', 'with', 'the', 'support', 'of', 'brexit', 'growth', 'in', 'entire', 'snowland', 'and', 'the', 'peoples', 'belive', 'it', 'to', 'be', 'a', 'success']","['ritesh', 'deshi', 'results', 'prefect', 'support', 'brexit', 'growth', 'entire', 'snowland', 'peoples', 'belive', 'success']","['ritesh', 'deshi', 'result', 'prefect', 'support', 'brexit', 'growth', 'entire', 'snowland', 'people', 'belive', 'success']",ritesh deshi result prefect support brexit growth entire snowland people belive success
